00:00.0 Host bridge [0600]: Intel Corporation Haswell-ULT DRAM Controller [8086:0a04] (rev 09)
	Subsystem: Intel Corporation Device [8086:2054]
	Control: I/O- Mem+ BusMaster+ SpecCycle- MemWINV- VGASnoop- ParErr- Stepping- SERR- FastB2B- DisINTx-
	Status: Cap+ 66MHz- UDF- FastB2B+ ParErr- DEVSEL=fast >TAbort- <TAbort- <MAbort+ >SERR- <PERR- INTx-
	Latency: 0
	Capabilities: [e0] Vendor Specific Information: Len=0c <?>

00:02.0 VGA compatible controller [0300]: Intel Corporation Haswell-ULT Integrated Graphics Controller [8086:0a26] (rev 09) (prog-if 00 [VGA controller])
	Subsystem: Intel Corporation Device [8086:2054]
	Control: I/O+ Mem+ BusMaster+ SpecCycle- MemWINV- VGASnoop- ParErr- Stepping- SERR- FastB2B- DisINTx+
	Status: Cap+ 66MHz- UDF- FastB2B+ ParErr- DEVSEL=fast >TAbort- <TAbort- <MAbort- >SERR- <PERR- INTx-
	Latency: 0
	Interrupt: pin A routed to IRQ 62
	Region 0: Memory at f7800000 (64-bit, non-prefetchable) [size=4M]
	Region 2: Memory at e0000000 (64-bit, prefetchable) [size=256M]
	Region 4: I/O ports at f000 [size=64]
	Expansion ROM at <unassigned> [disabled]
	Capabilities: [90] MSI: Enable+ Count=1/1 Maskable- 64bit-
		Address: fee00018  Data: 0000
	Capabilities: [d0] Power Management version 2
		Flags: PMEClk- DSI+ D1- D2- AuxCurrent=0mA PME(D0-,D1-,D2-,D3hot-,D3cold-)
		Status: D0 NoSoftRst- PME-Enable- DSel=0 DScale=0 PME-
	Capabilities: [a4] PCI Advanced Features
		AFCap: TP+ FLR+
		AFCtrl: FLR-
		AFStatus: TP-
	Kernel driver in use: i915

00:03.0 Audio device [0403]: Intel Corporation Haswell-ULT HD Audio Controller [8086:0a0c] (rev 09)
	Subsystem: Intel Corporation Device [8086:2054]
	Control: I/O- Mem+ BusMaster+ SpecCycle- MemWINV- VGASnoop- ParErr- Stepping- SERR- FastB2B- DisINTx+
	Status: Cap+ 66MHz- UDF- FastB2B- ParErr- DEVSEL=fast >TAbort- <TAbort- <MAbort- >SERR- <PERR- INTx-
	Latency: 0, Cache Line Size: 64 bytes
	Interrupt: pin A routed to IRQ 63
	Region 0: Memory at f7c34000 (64-bit, non-prefetchable) [size=16K]
	Capabilities: [50] Power Management version 2
		Flags: PMEClk- DSI- D1- D2- AuxCurrent=0mA PME(D0-,D1-,D2-,D3hot-,D3cold-)
		Status: D0 NoSoftRst- PME-Enable- DSel=0 DScale=0 PME-
	Capabilities: [60] MSI: Enable+ Count=1/1 Maskable- 64bit-
		Address: fee00318  Data: 0000
	Capabilities: [70] Express (v1) Root Complex Integrated Endpoint, MSI 00
		DevCap:	MaxPayload 128 bytes, PhantFunc 0
			ExtTag- RBE-
		DevCtl:	Report errors: Correctable- Non-Fatal- Fatal- Unsupported-
			RlxdOrd- ExtTag- PhantFunc- AuxPwr- NoSnoop-
			MaxPayload 128 bytes, MaxReadReq 128 bytes
		DevSta:	CorrErr- UncorrErr- FatalErr- UnsuppReq- AuxPwr- TransPend-
	Kernel driver in use: snd_hda_intel

00:14.0 USB controller [0c03]: Intel Corporation Lynx Point-LP USB xHCI HC [8086:9c31] (rev 04) (prog-if 30 [XHCI])
	Subsystem: Intel Corporation Device [8086:2054]
	Control: I/O- Mem+ BusMaster+ SpecCycle- MemWINV- VGASnoop- ParErr- Stepping- SERR- FastB2B- DisINTx+
	Status: Cap+ 66MHz- UDF- FastB2B+ ParErr- DEVSEL=medium >TAbort- <TAbort- <MAbort- >SERR- <PERR- INTx-
	Latency: 0
	Interrupt: pin A routed to IRQ 58
	Region 0: Memory at f7c20000 (64-bit, non-prefetchable) [size=64K]
	Capabilities: [70] Power Management version 2
		Flags: PMEClk- DSI- D1- D2- AuxCurrent=375mA PME(D0-,D1-,D2-,D3hot+,D3cold+)
		Status: D0 NoSoftRst+ PME-Enable- DSel=0 DScale=0 PME-
	Capabilities: [80] MSI: Enable+ Count=1/8 Maskable- 64bit+
		Address: 00000000fee00258  Data: 0000
	Kernel driver in use: xhci_hcd

00:16.0 Communication controller [0780]: Intel Corporation Lynx Point-LP HECI #0 [8086:9c3a] (rev 04)
	Subsystem: Intel Corporation Device [8086:2054]
	Control: I/O- Mem+ BusMaster+ SpecCycle- MemWINV- VGASnoop- ParErr- Stepping- SERR- FastB2B- DisINTx+
	Status: Cap+ 66MHz- UDF- FastB2B- ParErr- DEVSEL=fast >TAbort- <TAbort- <MAbort- >SERR- <PERR- INTx-
	Latency: 0
	Interrupt: pin A routed to IRQ 61
	Region 0: Memory at f7c3e000 (64-bit, non-prefetchable) [size=32]
	Capabilities: [50] Power Management version 3
		Flags: PMEClk- DSI- D1- D2- AuxCurrent=0mA PME(D0+,D1-,D2-,D3hot+,D3cold+)
		Status: D0 NoSoftRst+ PME-Enable- DSel=0 DScale=0 PME-
	Capabilities: [8c] MSI: Enable+ Count=1/1 Maskable- 64bit+
		Address: 00000000fee002f8  Data: 0000
	Kernel driver in use: mei_me

00:19.0 Ethernet controller [0200]: Intel Corporation Ethernet Connection I218-V [8086:1559] (rev 04)
	Subsystem: Intel Corporation Device [8086:2054]
	Control: I/O+ Mem+ BusMaster+ SpecCycle- MemWINV- VGASnoop- ParErr- Stepping- SERR- FastB2B- DisINTx+
	Status: Cap+ 66MHz- UDF- FastB2B- ParErr- DEVSEL=fast >TAbort- <TAbort- <MAbort- >SERR- <PERR- INTx-
	Latency: 0
	Interrupt: pin A routed to IRQ 60
	Region 0: Memory at f7c00000 (32-bit, non-prefetchable) [size=128K]
	Region 1: Memory at f7c3c000 (32-bit, non-prefetchable) [size=4K]
	Region 2: I/O ports at f080 [size=32]
	Capabilities: [c8] Power Management version 2
		Flags: PMEClk- DSI+ D1- D2- AuxCurrent=0mA PME(D0+,D1-,D2-,D3hot+,D3cold+)
		Status: D0 NoSoftRst- PME-Enable- DSel=0 DScale=1 PME-
	Capabilities: [d0] MSI: Enable+ Count=1/1 Maskable- 64bit+
		Address: 00000000fee002d8  Data: 0000
	Capabilities: [e0] PCI Advanced Features
		AFCap: TP+ FLR+
		AFCtrl: FLR-
		AFStatus: TP-
	Kernel driver in use: e1000e

00:1b.0 Audio device [0403]: Intel Corporation Lynx Point-LP HD Audio Controller [8086:9c20] (rev 04)
	Subsystem: Intel Corporation Device [8086:2054]
	Control: I/O- Mem+ BusMaster+ SpecCycle- MemWINV- VGASnoop- ParErr- Stepping- SERR- FastB2B- DisINTx+
	Status: Cap+ 66MHz- UDF- FastB2B- ParErr- DEVSEL=fast >TAbort- <TAbort- <MAbort- >SERR- <PERR- INTx-
	Latency: 0, Cache Line Size: 64 bytes
	Interrupt: pin A routed to IRQ 64
	Region 0: Memory at f7c30000 (64-bit, non-prefetchable) [size=16K]
	Capabilities: [50] Power Management version 3
		Flags: PMEClk- DSI- D1- D2- AuxCurrent=55mA PME(D0+,D1-,D2-,D3hot+,D3cold+)
		Status: D0 NoSoftRst- PME-Enable- DSel=0 DScale=0 PME-
	Capabilities: [60] MSI: Enable+ Count=1/1 Maskable- 64bit+
		Address: 00000000fee00358  Data: 0000
	Capabilities: [70] Express (v1) Root Complex Integrated Endpoint, MSI 00
		DevCap:	MaxPayload 128 bytes, PhantFunc 0
			ExtTag- RBE-
		DevCtl:	Report errors: Correctable- Non-Fatal- Fatal- Unsupported-
			RlxdOrd- ExtTag- PhantFunc- AuxPwr- NoSnoop-
			MaxPayload 128 bytes, MaxReadReq 128 bytes
		DevSta:	CorrErr- UncorrErr- FatalErr- UnsuppReq- AuxPwr+ TransPend-
	Capabilities: [100 v1] Virtual Channel
		Caps:	LPEVC=0 RefClk=100ns PATEntryBits=1
		Arb:	Fixed- WRR32- WRR64- WRR128-
		Ctrl:	ArbSelect=Fixed
		Status:	InProgress-
		VC0:	Caps:	PATOffset=00 MaxTimeSlots=1 RejSnoopTrans-
			Arb:	Fixed- WRR32- WRR64- WRR128- TWRR128- WRR256-
			Ctrl:	Enable+ ID=0 ArbSelect=Fixed TC/VC=01
			Status:	NegoPending- InProgress-
		VC1:	Caps:	PATOffset=00 MaxTimeSlots=1 RejSnoopTrans-
			Arb:	Fixed- WRR32- WRR64- WRR128- TWRR128- WRR256-
			Ctrl:	Enable- ID=2 ArbSelect=Fixed TC/VC=04
			Status:	NegoPending- InProgress-
	Kernel driver in use: snd_hda_intel

00:1d.0 USB controller [0c03]: Intel Corporation Lynx Point-LP USB EHCI #1 [8086:9c26] (rev 04) (prog-if 20 [EHCI])
	Subsystem: Intel Corporation Device [8086:2054]
	Control: I/O- Mem+ BusMaster+ SpecCycle- MemWINV- VGASnoop- ParErr- Stepping- SERR- FastB2B- DisINTx-
	Status: Cap+ 66MHz- UDF- FastB2B+ ParErr- DEVSEL=medium >TAbort- <TAbort- <MAbort- >SERR- <PERR- INTx-
	Latency: 0
	Interrupt: pin A routed to IRQ 23
	Region 0: Memory at f7c3b000 (32-bit, non-prefetchable) [size=1K]
	Capabilities: [50] Power Management version 3
		Flags: PMEClk- DSI- D1- D2- AuxCurrent=375mA PME(D0+,D1-,D2-,D3hot+,D3cold+)
		Status: D0 NoSoftRst+ PME-Enable- DSel=0 DScale=0 PME-
	Capabilities: [58] Debug port: BAR=1 offset=00a0
	Capabilities: [98] PCI Advanced Features
		AFCap: TP+ FLR+
		AFCtrl: FLR-
		AFStatus: TP-
	Kernel driver in use: ehci-pci

00:1f.0 ISA bridge [0601]: Intel Corporation Lynx Point-LP LPC Controller [8086:9c43] (rev 04)
	Subsystem: Intel Corporation Device [8086:2054]
	Control: I/O+ Mem+ BusMaster+ SpecCycle- MemWINV- VGASnoop- ParErr- Stepping- SERR- FastB2B- DisINTx-
	Status: Cap+ 66MHz- UDF- FastB2B- ParErr- DEVSEL=medium >TAbort- <TAbort- <MAbort- >SERR- <PERR- INTx-
	Latency: 0
	Capabilities: [e0] Vendor Specific Information: Len=0c <?>
	Kernel driver in use: lpc_ich

00:1f.2 SATA controller [0106]: Intel Corporation Lynx Point-LP SATA Controller 1 [AHCI mode] [8086:9c03] (rev 04) (prog-if 01 [AHCI 1.0])
	Subsystem: Intel Corporation Device [8086:2054]
	Control: I/O+ Mem+ BusMaster+ SpecCycle- MemWINV- VGASnoop- ParErr- Stepping- SERR- FastB2B- DisINTx+
	Status: Cap+ 66MHz+ UDF- FastB2B+ ParErr- DEVSEL=medium >TAbort- <TAbort- <MAbort- >SERR- <PERR- INTx-
	Latency: 0
	Interrupt: pin B routed to IRQ 59
	Region 0: I/O ports at f0d0 [size=8]
	Region 1: I/O ports at f0c0 [size=4]
	Region 2: I/O ports at f0b0 [size=8]
	Region 3: I/O ports at f0a0 [size=4]
	Region 4: I/O ports at f060 [size=32]
	Region 5: Memory at f7c3a000 (32-bit, non-prefetchable) [size=2K]
	Capabilities: [80] MSI: Enable+ Count=1/1 Maskable- 64bit-
		Address: fee00298  Data: 0000
	Capabilities: [70] Power Management version 3
		Flags: PMEClk- DSI- D1- D2- AuxCurrent=0mA PME(D0-,D1-,D2-,D3hot+,D3cold-)
		Status: D0 NoSoftRst+ PME-Enable- DSel=0 DScale=0 PME-
	Capabilities: [a8] SATA HBA v1.0 BAR4 Offset=00000004
	Kernel driver in use: ahci

00:1f.3 SMBus [0c05]: Intel Corporation Lynx Point-LP SMBus Controller [8086:9c22] (rev 04)
	Subsystem: Intel Corporation Device [8086:2054]
	Control: I/O+ Mem+ BusMaster- SpecCycle- MemWINV- VGASnoop- ParErr- Stepping- SERR- FastB2B- DisINTx-
	Status: Cap- 66MHz- UDF- FastB2B+ ParErr- DEVSEL=medium >TAbort- <TAbort- <MAbort- >SERR- <PERR- INTx-
	Interrupt: pin C routed to IRQ 5
	Region 0: Memory at f7c39000 (64-bit, non-prefetchable) [size=256]
	Region 4: I/O ports at f040 [size=32]

